{
  "format": "pose-hub-catalog",
  "formatVersion": 1,
  "version": "0.1.0",
  "generatedAt": "2026-10-19T23:59:26+08:00",
  "source": {
    "repo": "mhgd3250905/3D-Pose-Hub",
    "commit": "b6c6bd9",
    "inputs": [
      {
        "repo": "mhgd3250905/Sport-Helper",
        "commit": "6d4eb30"
      },
      {
        "repo": "mhgd3250905/HipLab",
        "commit": "cdbb14c"
      },
      {
        "repo": "mhgd3250905/3D-Body",
        "commit": "2be8cca"
      }
    ],
    "hiplabSnapshot": {
      "sdkCommit": "76829bd290ff86cbce4f9029657cc2a20e3f2ef4",
      "filter": {
        "apps": [
          "hiplab"
        ]
      }
    },
    "hiplabDoseSource": {
      "path": "assets/action_kits/index.json",
      "sha256": "be4c05c66e86e32152a30b523553d654e2c1820b722b7fffce1a32174e060396",
      "rules": "HipLab action-kit training defaults including holdSeconds; first video repSeconds is the complete kit cycle; no motion IDs added",
      "alignedCatalog": {
        "sdkCommit": "66dd98a549c1ff5fedecb626a7c88583090a1440",
        "path": "packages/ugk_trainer/assets/pose_hub/app-test-pack-r1/catalog/catalog.json",
        "version": "0.3.0",
        "sha256": "40610dbb71b58886ebe001409ae15161761747b4f776e74a252e7b1f8df6e983",
        "unitCorrections": [
          "h-adductor-rock",
          "h-knee-hug",
          "h-sumo-pry",
          "n-pelvis-circle",
          "n-seated-ir-drop",
          "n-seated-knee-lift",
          "n-seated-squeeze",
          "n-squat-shift"
        ]
      }
    }
  },
  "taxonomy": {
    "categories": {
      "strength": {
        "zh": "力量",
        "en": "Strength"
      },
      "core": {
        "zh": "核心",
        "en": "Core"
      },
      "cardio": {
        "zh": "有氧",
        "en": "Cardio"
      },
      "mobility": {
        "zh": "灵活/活动度",
        "en": "Mobility"
      },
      "stretch": {
        "zh": "拉伸",
        "en": "Stretch"
      }
    },
    "muscleGroups": {
      "deltoids": {
        "zh": "三角肌"
      },
      "rotator-cuff": {
        "zh": "肩袖肌群"
      },
      "triceps": {
        "zh": "肱三头肌"
      },
      "biceps": {
        "zh": "肱二头肌"
      },
      "forearms": {
        "zh": "前臂 · 腕屈伸肌"
      },
      "serratus": {
        "zh": "前锯肌"
      },
      "scapular": {
        "zh": "斜方肌中下部 · 菱形肌"
      },
      "chest": {
        "zh": "胸大肌"
      },
      "lats": {
        "zh": "背阔肌"
      },
      "abs": {
        "zh": "腹直肌（含深层腹横肌）"
      },
      "obliques": {
        "zh": "腹斜肌"
      },
      "erectors": {
        "zh": "竖脊肌"
      },
      "hip-flexors": {
        "zh": "髋屈肌"
      },
      "glute-max": {
        "zh": "臀大肌"
      },
      "hip-abductors": {
        "zh": "臀中肌 · 髋外展"
      },
      "adductors": {
        "zh": "内收肌群"
      },
      "quadriceps": {
        "zh": "股四头肌"
      },
      "hamstrings": {
        "zh": "腘绳肌"
      },
      "calves": {
        "zh": "小腿三头肌"
      },
      "tibialis": {
        "zh": "胫骨前肌"
      }
    },
    "equipment": {
      "mat": {
        "zh": "瑜伽垫",
        "scenes": [
          "home",
          "gym"
        ]
      },
      "chair": {
        "zh": "椅子/凳子",
        "scenes": [
          "home",
          "office",
          "gym"
        ]
      },
      "wall": {
        "zh": "墙",
        "scenes": [
          "home",
          "office",
          "gym"
        ]
      },
      "block": {
        "zh": "瑜伽砖（可用厚书代替）",
        "scenes": [
          "home",
          "gym"
        ]
      },
      "band": {
        "zh": "弹力带",
        "scenes": [
          "gym"
        ]
      },
      "dumbbell": {
        "zh": "哑铃",
        "scenes": [
          "gym"
        ]
      },
      "slider": {
        "zh": "滑垫（可用毛巾代替）",
        "scenes": [
          "gym"
        ]
      },
      "kettlebell": {
        "zh": "壶铃",
        "scenes": [
          "gym"
        ]
      },
      "parallettes": {
        "zh": "平行杆（俯撑架）",
        "scenes": [
          "gym"
        ]
      },
      "pullup-bar": {
        "zh": "单杠",
        "scenes": [
          "gym"
        ]
      },
      "foam-roller": {
        "zh": "泡沫轴",
        "scenes": [
          "gym"
        ]
      },
      "swiss-ball": {
        "zh": "瑞士球",
        "scenes": [
          "gym"
        ]
      },
      "dip-bars": {
        "zh": "双杠",
        "scenes": [
          "gym"
        ]
      },
      "rings": {
        "zh": "吊环",
        "scenes": [
          "gym"
        ]
      },
      "cable": {
        "zh": "绳索器械",
        "scenes": [
          "gym"
        ]
      },
      "landmine": {
        "zh": "地雷杆",
        "scenes": [
          "gym"
        ]
      },
      "roman-chair": {
        "zh": "45° 罗马椅",
        "scenes": [
          "gym"
        ]
      },
      "ghd": {
        "zh": "GHD 臀腿训练器",
        "scenes": [
          "gym"
        ]
      },
      "reverse-hyper": {
        "zh": "反向背伸机",
        "scenes": [
          "gym"
        ]
      },
      "hip-abductor-machine": {
        "zh": "髋外展机",
        "scenes": [
          "gym"
        ]
      },
      "leg-extension-machine": {
        "zh": "腿屈伸机",
        "scenes": [
          "gym"
        ]
      }
    },
    "positions": {
      "standing": {
        "zh": "站姿",
        "floor": false
      },
      "seated": {
        "zh": "坐姿",
        "floor": false
      },
      "supine": {
        "zh": "仰卧",
        "floor": true
      },
      "prone": {
        "zh": "俯卧/俯撑",
        "floor": true
      },
      "quadruped": {
        "zh": "四足跪撑",
        "floor": true
      },
      "kneeling": {
        "zh": "跪姿",
        "floor": true
      },
      "side_lying": {
        "zh": "侧卧/侧撑",
        "floor": true
      },
      "support": {
        "zh": "器械支撑（平行杆/双杠/吊环）",
        "floor": false
      },
      "hanging": {
        "zh": "悬垂",
        "floor": false
      }
    },
    "scenes": {
      "home": {
        "zh": "居家"
      },
      "office": {
        "zh": "办公室"
      },
      "gym": {
        "zh": "健身房"
      }
    },
    "cautions": [
      "膝",
      "腰",
      "肩",
      "手腕",
      "颈",
      "髋",
      "大腿内侧"
    ],
    "rules": {
      "sceneMatch": "动作 scenes 含请求场所即可用；健身房请求额外接受 scenes 含 home 的动作（健身房有垫/凳/墙）。办公室请求不接受 floor=true 的体位。",
      "equipmentByScene": "用户没说器械时：home 默认有 mat/chair/wall/block；office 默认有 chair/wall；gym 默认有全部器械。徒手 = equipment 为空。"
    }
  },
  "apps": {
    "hiplab": {
      "name": "开胯训练助手 HipLab",
      "repo": "mhgd3250905/HipLab",
      "commit": "cdbb14c",
      "mediaFormat": "action-kit@1"
    }
  },
  "drills": [
    {
      "id": "h-adductor-rock",
      "name": {
        "zh": "四足单腿侧伸后摇",
        "en": "Quadruped Adductor Rock-Back"
      },
      "purpose": "拉伸大腿内侧",
      "category": "stretch",
      "muscles": [
        "大腿内侧"
      ],
      "muscleGroups": [
        "adductors"
      ],
      "equipment": [
        "mat"
      ],
      "position": "quadruped",
      "unilateral": true,
      "level": 1,
      "scenes": [
        "home"
      ],
      "defaultDose": {
        "mode": "reps",
        "sets": 1,
        "reps": 5,
        "restSeconds": 15
      },
      "doseRange": {
        "sets": [
          1,
          3
        ],
        "reps": [
          1,
          10
        ],
        "restSeconds": [
          0,
          60
        ]
      },
      "cues": {
        "zh": [
          "一条腿向侧面伸直，臀部慢慢往后坐",
          "臀部向后摇，大腿内侧拉长"
        ]
      },
      "primaryCue": 0,
      "cautions": [
        "膝"
      ],
      "contraindications": [],
      "alternative": null,
      "apps": [
        "hiplab",
        "smartfit"
      ],
      "tags": [
        "hip",
        "hip:abduction",
        "hip:flexion"
      ],
      "assets": {
        "spec": {
          "status": "ok",
          "path": "drill-anim/specs/h-adductor-rock.js",
          "sha256": "d8d0601eb573cac10093a6d8fe6faec47040fbe22ab269801666b62f3f12eddd",
          "revisionOf": null,
          "modelProfile": "training-human-v2"
        },
        "releases": [
          "0.1.0",
          "0.2.0"
        ],
        "cover": {
          "status": "ok",
          "sources": [
            {
              "app": "smartfit",
              "path": "assets/packs/h-adductor-rock/cover.jpg",
              "width": 540,
              "height": 540,
              "coverSeconds": 2.4
            },
            {
              "app": "hiplab",
              "variant": "dark",
              "path": "assets/drill_media/hip-h-adductor-rock.jpg"
            },
            {
              "app": "hiplab",
              "variant": "light",
              "path": "assets/drill_media/light/hip-h-adductor-rock.jpg"
            },
            {
              "app": "pose-hub",
              "release": "0.1.0",
              "variant": "dark",
              "path": "h-adductor-rock/h-adductor-rock.dark.poster.1080.jpg",
              "width": 1080,
              "height": 1080,
              "sha256": "b17db170723c52865cd1d891cb349b435115f5edeac400fd5dd71b39c86577f8",
              "bytes": 31021
            },
            {
              "app": "pose-hub",
              "release": "0.2.0",
              "variant": "dark",
              "path": "h-adductor-rock/h-adductor-rock.dark.poster.540.jpg",
              "width": 540,
              "height": 540,
              "sha256": "c8cd6a809953ec840825b106d6941370ecf9716b5820fbf44e2de334f1c07d34",
              "bytes": 11204
            }
          ]
        },
        "video": {
          "status": "ok",
          "sources": [
            {
              "app": "smartfit",
              "path": "assets/packs/h-adductor-rock/demo.mp4",
              "width": 720,
              "height": 720,
              "loopSeconds": 8.0,
              "showsSide": "right",
              "repSeconds": 4.0
            },
            {
              "app": "hiplab",
              "variant": "dark",
              "path": "assets/drill_media/hip-h-adductor-rock.mp4",
              "loopSeconds": 8.0,